{"acceptance_checkpoint_digest":"1a3175e63a0a15b6e43c88f2927cede71af37e3287c5d78fad19a5349377455e","accepted_at_utc":"2026-09-24T22:45:42.929518Z","authorities":{"ACQUISITION_FREEZE":"340763a2eecaa7233dc6132010c994b57112339b94daec56d4b878ee80900280","P04_FEATURE_REGISTRY":"e41d78a122be15a01986f0b914518209843108062313d7d55f62e308d37aaf65","P05_RELEASE_INDEX":"2218778725039c956f739d116810b9cc89b5354a31adf61cbe359e3ceeb608f4","P05_RELEASE_MANIFEST":"c0bf854800ee96cb29aaea4ebb3e196ec9c07fcc4b494b2cf0491dee917d6fe8","P06_FEATURE_RANGE_ERRATA":"01fbaccbdc9cee7e191a2f4b029094c4e231e98c5d19da8b6fd7115a6de916b8","PREFIT_P01":"1e0e6a4c62e400a9c7bd682923868cb62bde7f879de7167ecd91a041df2be8f1","PREFIT_P02":"40ff18bbac4c927ae600fd54026671493f4e68e5e0d65cdf07374965837cf607","PREFIT_P03":"c1201500ecfd5ed6eac60d45889c4b7ecdd2620c76998c00a1769531c9479f3b","PREFIT_P04":"70515a2e73fbe0cef9775d01a566fbbd03f10e81978de3d96a728e4615227dc2","PREFIT_P05":"7e1366d32972aa492ae1064c354bfb0261401f59a16e16a26e12a65df96c4132","R14_CYCLE_SCHEDULE":"7f6676d802137faba08000e2a2f93ff21079283de41246d3e3d46d894ead6f45"},"frozen_files":{"RAFM_V375_UNIVERSAL_MODELING_PREFIT_PLAN.md":"07de6086fc2de0f31b8cdcf9d999421229a8b5a9d3a59ee100d9a72ea1e8ed00","config/issue_time_views_r14_v375.json":"2f0b0bf31ce05588e5ceb5152afeea5fbb4392dac055719b88ff78ba7c65ac9c","config/prefit/p01_foundation_v375.json":"9799a059c9dcd4c52737c87daa36ba45a7af2cbc5c0fd776730b585aa7c2e262","config/prefit/p02_truth_v375.json":"a7609e9e3f13d63ecaefc58063633e699d160cd32a2c3ba976bde11a59cdb662","config/prefit/p03_issue_spine_v375.json":"324c3f47304d8f63ac2de7b303e0944d9c115cbd82a0fbe031ee619eeefb86bf","config/prefit/p04_features_v375.json":"841adad85a9b0b3ef9b9677b079012a33e96ff721663310767af46d215b200aa","config/prefit/p05_materialization_v375.json":"c8ea1f2335633fdf75d7cfc5fe44ed15dde3ed579b418224ab8d6a9d9510c8bf","config/prefit/p06_acceptance_v375.json":"521effb0f29d9b743372a62114dce5950192705a4499a8e193cf64f9a0680970","config/prefit/p06_feature_contract_errata_v375.json":"01fbaccbdc9cee7e191a2f4b029094c4e231e98c5d19da8b6fd7115a6de916b8","environment/prefit/v1/environment.json":"cc6c378ce6141cbd2ea271484f0c054c8f813b4de1f5e0548d8cf4597f3f630f","hrrr_v4_local_archive/common/cycle_schedule_r14/cycle_schedule_r14_v375.parquet":"7f6676d802137faba08000e2a2f93ff21079283de41246d3e3d46d894ead6f45","hrrr_v4_local_archive/common/cycle_schedule_r14/cycle_schedule_r14_v375_manifest.json":"3c0ae6db4290a01a190d23492349df61593d4d44a006c2094660497d0c013e55","pyproject.toml":"025296d9ea4d843b35e70360663aea8b3c6ccf6d17c1f48bb7af3791f863e74c","registries/registry_bundle_r14_v375.json":"2b6ef889c0282071fe09035398881ac11bf8b69c1728b82c7b00dec46300e83b","reports/kden_v375_acquisition_freeze_manifest.json":"340763a2eecaa7233dc6132010c994b57112339b94daec56d4b878ee80900280","reports/prefit/P06_OWNER_RUNBOOK.md":"d4c287d1df61a2e674249933f0ef010842c0484be7692d30a64b704a51321e7b","schemas/prefit/deterministic_feature_panel_v375.json":"473d639e50c246c0544ade8ed107d9b0e938de385a08088cc843addc50cd184e","schemas/prefit/issue_spine_v375.json":"f008bf790b66f52af976ff64542865156a24ae77eabd0e83cdccbb6484a22697","schemas/prefit/p01_foundation_v375.json":"f0ca6c7544f14d8b1fabe0f98354287934ea65615b79cfdcc445e91432384c6d","schemas/prefit/p02_run_state_v375.json":"cab656811d102f57f9099e09949effe90dacdd3069cbee521f5e31e6146eb4c1","schemas/prefit/p03_run_state_v375.json":"3ad8a22b3e02229a62874b0efbe2fea439a154e746e7e27e73b530d0f2485ca2","schemas/prefit/p03_selection_manifest_v375.json":"7465ec0261f39258c4a78f1637565c8af9a0720b98934b37cf8c0ffb0d7ac9d6","schemas/prefit/p04_feature_registry_v375.json":"16c8379d40b97d22d394cee64e001ce5c3ababcd3cfd46fa86ea8a6d88ec9c3c","schemas/prefit/p05_release_manifest_v375.json":"ff39e39c7940bf115ad26fc34a7b82c6425532b72155ef32f726d3e973067a36","schemas/prefit/p05_run_state_v375.json":"5dd21462f1d7473143a69e378520fdae1a1e974bcda0f2eec4c1886d99f6ac7b","schemas/prefit/p06_feature_contract_errata_v375.json":"14d2abed88407478652f1763332c44449298202c81faa87732eebf2c548d8cde","schemas/prefit/p06_freeze_manifest_v375.json":"4fb9ad8caa72c18469009c885c8f940484b926c4ec8398040a4bd2fa612f05c8","schemas/prefit/p06_run_state_v375.json":"f786316a0f64f4305f3e1e11ea3d5d10b4fb27f4846cc13d76976a05573e0443","schemas/prefit/prefit_pass_v375.json":"ca67c9c4de38aabad60b6664ec87fb18152804ea2b307d7cd46c5b99e808aa1e","schemas/prefit/selected_cycles_v375.json":"85ff581d8f42e93c2a48db811ae4d164a1cfbefbf4c9f3a097316b99227ac367","schemas/prefit/time_ontology_v375.json":"210b965aff3079b9509dfd1d38a6ebcb8e4840e0931a76d247b65589ec8e3eda","schemas/prefit/trajectory_catalog_v375.json":"a4c8abbe33d64089f71a4f0f73004c8a769e8ebda3772c3e1b67be64f450ae74","schemas/prefit/truth_adoption_manifest_v375.json":"cc2dea1005a0eb4d9fb18a08cfc4171c47e21d7c0abfcb5ac82840319526c041","schemas/prefit/truth_catalog_v375.json":"88bf93ca53460d64e70c816fce92d061036bd0bcd19247aad0ff90b2a6328fd3","schemas/prefit/truth_evidence_roles_v375.json":"de2b4cd0f66a8a0bcdbd12df9ea31ee4f2a5a5b2567113d54ed66197c7c922d6","schemas/prefit/universal_issue_state_pass_v375.json":"1eee220d0d0aa63a807f363c3b475cf6d7fa85769d6bbdb2494dd64cf3939b66","src/kden_v375/archive_readers.py":"3b9439c61e1601ee631136a24af61d3354ccc4b9aa92d722a30b8337a024913c","src/kden_v375/contracts.py":"ab7236e593efaa4941f1fca9cea5012d80808eaa734ac96ab569b12943b0aeb2","src/kden_v375/hashes.py":"448249cf90c743a196ba3cf042ffc019d1cc9cfbd460026983672878c567cbb8","src/kden_v375/prefit/cli.py":"2dcadcbfa208e4846469d154355c51ca737db6e92e6258bf90b212b124d110e3","src/kden_v375/prefit/p01_foundation.py":"7e496301d64e7a75132379c84fd6d3e5f8badc870d1d4d6099e2f4dbc8421f8c","src/kden_v375/prefit/p02_rules.py":"8f173b82a9a297fba30b33ae32d17b91d26f6d508ce4b068b424bafc6f36c55f","src/kden_v375/prefit/p02_truth.py":"3aeb3f5923c602aaacbdff50787486951ca7ba43716a5073d92832428b0314fc","src/kden_v375/prefit/p03_issue_spine.py":"96cb6b288dba1112146bc36cad692fc4e013a32d40de24391439886497a00704","src/kden_v375/prefit/p04_features.py":"cdc8da8908f64377ff1d772cd854c97d6b707dd027031dce6a407bf95696c813","src/kden_v375/prefit/p05_materialization.py":"9bf88e0c8d9f37f435bed197d41d8e274050fb28c5afae313431fae3b92546fb","src/kden_v375/prefit/p06_acceptance.py":"6a68f0156063fd5ce24ebff85370fa0ffc0e08e31ecb48041b014a8e8558c308","src/kden_v375/prefit/records.py":"3cc6f83542a82f1f671876d968fa7016f96556d734a93dbd9477962b509bafd3","src/kden_v375/r14.py":"3acff09d3bcf93c964106a945069bd2d0e6e0011c0bb9c4ae8bc24fa3b31865e","src/kden_v375/time.py":"9478072b4d333b5cb4a198bd6fa56b77fc9cf6f527843ca1cab4fa947fa1f4a2","state/PREFIT_P01_PASS.json":"7f15923d4b4c2414026856b4a6c32149c42ded5a4238480276dc78587cd8da43","state/PREFIT_P02_PASS.json":"589fbe9032e83a1ee3e1373c2368570d12e46b883dcb9dfdc374af5efdd32d22","state/PREFIT_P03_PASS.json":"6e0421fe52022a434f00464cefa5ab6f0e979e50f62201c55e13f9ce34563321","state/PREFIT_P04_PASS.json":"4f67958c15774014ab06691324eba611cc86a9809a3d23341df2947fb83d9c08","state/PREFIT_P05_PASS.json":"84c3c9afff0af2bcf085611160af26d55907720982517425540557294a425f27","tests/unit/test_prefit_p06_acceptance.py":"938bb32bca77d925e17619b3dfa067ae9ef87771164ad9ac8ea5b6f767ce5aff","universal_issue_state/v1/deterministic_features/target_year=2021/part-2021.parquet":"b5598d70562a5ab5c6625fdbde9df00d383fb33f5578f95f3d992642581be883","universal_issue_state/v1/deterministic_features/target_year=2022/part-2022.parquet":"94afc13c66542d1027944dadf8e475c3c54275fff28d5e46a5ba8830948eab53","universal_issue_state/v1/deterministic_features/target_year=2023/part-2023.parquet":"758cbe2f015e225437803f6ecaa4ef1fb02799395f1cc8fa4096e2cc611552b2","universal_issue_state/v1/deterministic_features/target_year=2024/part-2024.parquet":"89e805e3d7014852bfedad0728e0bd630841ebcc7a2f9e7e0aa681c6a3fbefb3","universal_issue_state/v1/deterministic_features/target_year=2025/part-2025.parquet":"3ec36d74d63d943416de1c1b820acf09fd8e45c46d1cdb6e2e50a3890ff4787d","universal_issue_state/v1/deterministic_features/target_year=2026/part-2026.parquet":"e9d9df830eb7d3c8197262a776d415780c8b4bdce40cc5187a0ceff01bef39fc","universal_issue_state/v1/issue_spine/issue_spine.parquet":"c23c7276d9dea07511d58794b444c278d550bf87c74c9b6126ef91d431287b29","universal_issue_state/v1/manifests/p05_release_manifest.json":"c0bf854800ee96cb29aaea4ebb3e196ec9c07fcc4b494b2cf0491dee917d6fe8","universal_issue_state/v1/registries/universal_feature_registry_v1.json":"e41d78a122be15a01986f0b914518209843108062313d7d55f62e308d37aaf65","universal_issue_state/v1/release_index.json":"2218778725039c956f739d116810b9cc89b5354a31adf61cbe359e3ceeb608f4","universal_issue_state/v1/selected_cycles/selected_cycles.parquet":"4e65220bb91480c660cdbd073cdbe99bb08938fd8e65f29bcfdb2e099977ff0e","universal_issue_state/v1/trajectory_catalog/static/h14.parquet":"8b3bdbea21bb342487798d235fefa239a339d057c8c6d951a8e47eac0267e15f","universal_issue_state/v1/trajectory_catalog/target_year=2021/part-2021.parquet":"40ef5ed2b893c909cbb1e6003ae30c0ed60604ab569862760efd7259b8cacd7f","universal_issue_state/v1/trajectory_catalog/target_year=2022/part-2022.parquet":"380be7b225062d890fb5506081c8e43bd2e9c9f820c6de26721d55763aeed651","universal_issue_state/v1/trajectory_catalog/target_year=2023/part-2023.parquet":"18ff0854d2345ec85683c35ebf3f1b1f623f3224be5092df824e3e35c462f852","universal_issue_state/v1/trajectory_catalog/target_year=2024/part-2024.parquet":"c3f1ced3f188ffe9aa3bf8962b81528f52537209753e4b25bbc9b04634befad1","universal_issue_state/v1/trajectory_catalog/target_year=2025/part-2025.parquet":"c139793fc8c494a04f7fd97ffd911915c70621e294b8ea39c719175fa1df99f5","universal_issue_state/v1/trajectory_catalog/target_year=2026/part-2026.parquet":"96fbd7271283677aa678687e6349b9e8dbfd9fbd179f0313a0bfbd611591d4cf"},"gate_evidence":{"acceptance_id":"KDEN_V375_UNIVERSAL_ISSUE_STATE_ACCEPTANCE_V1","anchor_rebuild_count":7,"anchor_rebuilds_exact":true,"canonical_source_files_hashed":66558,"clock_equations_verified":true,"dst_verified":true,"dy